{
  "contract_version": "1.0",
  "case_id": "case-fixture-01",
  "steps": [
    {
      "t_start": 0.0,
      "t_end": 25.0,
      "confidence": 0.91,
      "provenance": {
        "trust_label": "ai_detected",
        "attributed_to": "ai",
        "generated_by": {
          "model_tier": "VISION_FAST",
          "model": "fixture",
          "prompt_version": "step_window.v1"
        },
        "confirmed_by": null,
        "confirmed_at": null
      },
      "id": "case-fixture-01.s001",
      "step_id": "rarp.p03.s01",
      "track": "ai"
    },
    {
      "t_start": 25.0,
      "t_end": 50.0,
      "confidence": 0.84,
      "provenance": {
        "trust_label": "ai_detected",
        "attributed_to": "ai",
        "generated_by": {
          "model_tier": "VISION_FAST",
          "model": "fixture",
          "prompt_version": "step_window.v1"
        },
        "confirmed_by": null,
        "confirmed_at": null
      },
      "id": "case-fixture-01.s002",
      "step_id": "rarp.p04.s01",
      "track": "ai"
    },
    {
      "t_start": 50.0,
      "t_end": 80.0,
      "confidence": 0.88,
      "provenance": {
        "trust_label": "ai_detected",
        "attributed_to": "ai",
        "generated_by": {
          "model_tier": "VISION_FAST",
          "model": "fixture",
          "prompt_version": "step_window.v1"
        },
        "confirmed_by": null,
        "confirmed_at": null
      },
      "id": "case-fixture-01.s003",
      "step_id": "rarp.p04.s02",
      "track": "ai"
    },
    {
      "t_start": 80.0,
      "t_end": 110.0,
      "confidence": 0.9,
      "provenance": {
        "trust_label": "ai_detected",
        "attributed_to": "ai",
        "generated_by": {
          "model_tier": "VISION_FAST",
          "model": "fixture",
          "prompt_version": "step_window.v1"
        },
        "confirmed_by": null,
        "confirmed_at": null
      },
      "id": "case-fixture-01.s004",
      "step_id": "rarp.p05.s01",
      "track": "ai"
    },
    {
      "t_start": 110.0,
      "t_end": 140.0,
      "confidence": 0.86,
      "provenance": {
        "trust_label": "ai_detected",
        "attributed_to": "ai",
        "generated_by": {
          "model_tier": "VISION_FAST",
          "model": "fixture",
          "prompt_version": "step_window.v1"
        },
        "confirmed_by": null,
        "confirmed_at": null
      },
      "id": "case-fixture-01.s005",
      "step_id": "rarp.p06.s01",
      "track": "ai"
    },
    {
      "t_start": 140.0,
      "t_end": 170.0,
      "confidence": 0.79,
      "provenance": {
        "trust_label": "ai_detected",
        "attributed_to": "ai",
        "generated_by": {
          "model_tier": "VISION_FAST",
          "model": "fixture",
          "prompt_version": "step_window.v1"
        },
        "confirmed_by": null,
        "confirmed_at": null
      },
      "id": "case-fixture-01.s006",
      "step_id": "rarp.p07.s02",
      "track": "ai"
    },
    {
      "t_start": 170.0,
      "t_end": 195.0,
      "confidence": 0.74,
      "provenance": {
        "trust_label": "ai_detected",
        "attributed_to": "ai",
        "generated_by": {
          "model_tier": "VISION_FAST",
          "model": "fixture",
          "prompt_version": "step_window.v1"
        },
        "confirmed_by": null,
        "confirmed_at": null
      },
      "id": "case-fixture-01.s007",
      "step_id": "rarp.p08.s01",
      "track": "ai"
    },
    {
      "t_start": 195.0,
      "t_end": 225.0,
      "confidence": 0.69,
      "provenance": {
        "trust_label": "ai_detected",
        "attributed_to": "ai",
        "generated_by": {
          "model_tier": "VISION_FAST",
          "model": "fixture",
          "prompt_version": "step_window.v1"
        },
        "confirmed_by": null,
        "confirmed_at": null
      },
      "id": "case-fixture-01.s008",
      "step_id": "rarp.p09.s02",
      "track": "ai"
    },
    {
      "t_start": 225.0,
      "t_end": 245.0,
      "confidence": 0.81,
      "provenance": {
        "trust_label": "ai_detected",
        "attributed_to": "ai",
        "generated_by": {
          "model_tier": "VISION_FAST",
          "model": "fixture",
          "prompt_version": "step_window.v1"
        },
        "confirmed_by": null,
        "confirmed_at": null
      },
      "id": "case-fixture-01.s009",
      "step_id": "rarp.p10.s01",
      "track": "ai"
    },
    {
      "t_start": 245.0,
      "t_end": 255.0,
      "confidence": 0.77,
      "provenance": {
        "trust_label": "ai_detected",
        "attributed_to": "ai",
        "generated_by": {
          "model_tier": "VISION_FAST",
          "model": "fixture",
          "prompt_version": "step_window.v1"
        },
        "confirmed_by": null,
        "confirmed_at": null
      },
      "id": "case-fixture-01.s010",
      "step_id": "rarp.p10.s02",
      "track": "ai"
    },
    {
      "t_start": 255.0,
      "t_end": 285.0,
      "confidence": 0.92,
      "provenance": {
        "trust_label": "ai_detected",
        "attributed_to": "ai",
        "generated_by": {
          "model_tier": "VISION_FAST",
          "model": "fixture",
          "prompt_version": "step_window.v1"
        },
        "confirmed_by": null,
        "confirmed_at": null
      },
      "id": "case-fixture-01.s011",
      "step_id": "rarp.p12.s01",
      "track": "ai"
    },
    {
      "t_start": 285.0,
      "t_end": 300.0,
      "confidence": 0.83,
      "provenance": {
        "trust_label": "ai_detected",
        "attributed_to": "ai",
        "generated_by": {
          "model_tier": "VISION_FAST",
          "model": "fixture",
          "prompt_version": "step_window.v1"
        },
        "confirmed_by": null,
        "confirmed_at": null
      },
      "id": "case-fixture-01.s012",
      "step_id": "rarp.p12.s02",
      "track": "ai"
    },
    {
      "t_start": 0.0,
      "t_end": 27.0,
      "confidence": 1.0,
      "provenance": {
        "trust_label": "dataset_annotation",
        "attributed_to": "dataset",
        "generated_by": null,
        "confirmed_by": null,
        "confirmed_at": null
      },
      "id": "case-fixture-01.s013",
      "step_id": "rarp.p03.s01",
      "track": "dataset"
    },
    {
      "t_start": 27.0,
      "t_end": 48.0,
      "confidence": 1.0,
      "provenance": {
        "trust_label": "dataset_annotation",
        "attributed_to": "dataset",
        "generated_by": null,
        "confirmed_by": null,
        "confirmed_at": null
      },
      "id": "case-fixture-01.s014",
      "step_id": "rarp.p04.s01",
      "track": "dataset"
    },
    {
      "t_start": 48.0,
      "t_end": 82.0,
      "confidence": 1.0,
      "provenance": {
        "trust_label": "dataset_annotation",
        "attributed_to": "dataset",
        "generated_by": null,
        "confirmed_by": null,
        "confirmed_at": null
      },
      "id": "case-fixture-01.s015",
      "step_id": "rarp.p04.s02",
      "track": "dataset"
    },
    {
      "t_start": 82.0,
      "t_end": 112.0,
      "confidence": 1.0,
      "provenance": {
        "trust_label": "dataset_annotation",
        "attributed_to": "dataset",
        "generated_by": null,
        "confirmed_by": null,
        "confirmed_at": null
      },
      "id": "case-fixture-01.s016",
      "step_id": "rarp.p05.s01",
      "track": "dataset"
    },
    {
      "t_start": 112.0,
      "t_end": 138.0,
      "confidence": 1.0,
      "provenance": {
        "trust_label": "dataset_annotation",
        "attributed_to": "dataset",
        "generated_by": null,
        "confirmed_by": null,
        "confirmed_at": null
      },
      "id": "case-fixture-01.s017",
      "step_id": "rarp.p06.s01",
      "track": "dataset"
    },
    {
      "t_start": 138.0,
      "t_end": 172.0,
      "confidence": 1.0,
      "provenance": {
        "trust_label": "dataset_annotation",
        "attributed_to": "dataset",
        "generated_by": null,
        "confirmed_by": null,
        "confirmed_at": null
      },
      "id": "case-fixture-01.s018",
      "step_id": "rarp.p07.s02",
      "track": "dataset"
    },
    {
      "t_start": 172.0,
      "t_end": 195.0,
      "confidence": 1.0,
      "provenance": {
        "trust_label": "dataset_annotation",
        "attributed_to": "dataset",
        "generated_by": null,
        "confirmed_by": null,
        "confirmed_at": null
      },
      "id": "case-fixture-01.s019",
      "step_id": "rarp.p08.s01",
      "track": "dataset"
    },
    {
      "t_start": 195.0,
      "t_end": 205.0,
      "confidence": 1.0,
      "provenance": {
        "trust_label": "dataset_annotation",
        "attributed_to": "dataset",
        "generated_by": null,
        "confirmed_by": null,
        "confirmed_at": null
      },
      "id": "case-fixture-01.s020",
      "step_id": "rarp.p09.s01",
      "track": "dataset"
    },
    {
      "t_start": 205.0,
      "t_end": 226.0,
      "confidence": 1.0,
      "provenance": {
        "trust_label": "dataset_annotation",
        "attributed_to": "dataset",
        "generated_by": null,
        "confirmed_by": null,
        "confirmed_at": null
      },
      "id": "case-fixture-01.s021",
      "step_id": "rarp.p09.s02",
      "track": "dataset"
    },
    {
      "t_start": 226.0,
      "t_end": 244.0,
      "confidence": 1.0,
      "provenance": {
        "trust_label": "dataset_annotation",
        "attributed_to": "dataset",
        "generated_by": null,
        "confirmed_by": null,
        "confirmed_at": null
      },
      "id": "case-fixture-01.s022",
      "step_id": "rarp.p10.s01",
      "track": "dataset"
    },
    {
      "t_start": 244.0,
      "t_end": 256.0,
      "confidence": 1.0,
      "provenance": {
        "trust_label": "dataset_annotation",
        "attributed_to": "dataset",
        "generated_by": null,
        "confirmed_by": null,
        "confirmed_at": null
      },
      "id": "case-fixture-01.s023",